{"benchmark_id":"swe_bench_verified","bundle_hash":"sha256:5e1fac959a50d93f87beec44a5c569baeecb2222bdac05b8dc0958a08d918c3b","bundle_id":"52f97759-7da6-55f5-8eda-d4b40445c446","candidate_id":"e109458a-d21c-50d7-908e-45c433b0321e","created_at":"2025-01-01T00:00:00.009Z","created_by_version":"0.1.0","files":[{"bytes":523,"path":"candidate_resolution.json","sha256":"sha256:0b70feb284718f1ab23fa3dc28474e040d23a6f0fab251ba955b9570cc17a8bc"},{"bytes":364,"path":"container_metadata.json","sha256":"sha256:13c1729f6b2e6d6d985637af2f97be2957ef2a4e7c476cb517e861e46d446764"},{"bytes":406,"path":"l1_trusted_rerun_results.json","sha256":"sha256:39427b7e3df7b0373d617e5e3b86efccedda832c001ea92aae24df1aa6daf23a"},{"bytes":333,"path":"official_results.json","sha256":"sha256:9f5ce9e19258d180d4be57f1d5baee456e2fe353a2c56e64ea2759e3f6f5f9d9"},{"bytes":529,"path":"patch.diff","sha256":"sha256:4bf05606ff37d427b5d1eff27a61b41489785d022c234933fbc8879cad5fd762"},{"bytes":457,"path":"policy_results.json","sha256":"sha256:f312137772a6890c7a78f19f3f5ea58356304b0c6d26de9e0ea5356bb4f400e1"},{"bytes":655,"path":"run_manifest.json","sha256":"sha256:e8723ff106868ffb8f2f033c7537540f74db5c26f3403d4cb883bc76bf9f50fa"},{"bytes":0,"path":"stderr.log","sha256":"sha256:e3b0c44298fc1c149afbf4c8996fb92427ae41e4649b934ca495991b7852b855"},{"bytes":1932,"path":"stdout.log","sha256":"sha256:a2c931f13d6d1c37566c670603d2591d3d2470b80488d429e69e0e9e4ff3ed75"},{"bytes":4484,"path":"trace.jsonl","sha256":"sha256:8ae7a4004ba703341bdbbebbf306d1a4a9c40a60645a8d74f09f2ded25f1d23f"}],"required_members_present":["candidate_resolution.json","run_manifest.json","trace.jsonl","official_results.json","patch.diff","container_metadata.json","stdout.log","stderr.log","artifact_hashes.json"],"schema_version":1,"task_id":"pydata__xarray-2905"}
