{"benchmark_id":"swe_bench_verified","bundle_hash":"sha256:35b1c6ffd146666aa1e239fb8f9012d2f18ef5cd00db7175f1edc4297784575d","bundle_id":"ab9670e5-ab69-5b5e-8d78-7286f165e2d4","candidate_id":"98ee27cf-5f29-50ee-9c5d-20f25a7d0044","created_at":"2025-01-01T00:00:00.011Z","created_by_version":"0.1.0","files":[{"bytes":554,"path":"candidate_resolution.json","sha256":"sha256:1df5225b89ed347e12909d92ba94f37042c07d72d4e50739656ac8dc42ac82ec"},{"bytes":340,"path":"container_metadata.json","sha256":"sha256:ed00333b4ddac4bebd4a205d554c0a2082b0deceec95750fac3799826f4cf0d8"},{"bytes":434,"path":"l1_trusted_rerun_results.json","sha256":"sha256:b9fcd27d22ae682b0b5c0cf152e4902631c7a6eec7705da787afe20c1ec27c15"},{"bytes":349,"path":"official_results.json","sha256":"sha256:92a9d994e01148e3e4be870f2264ba7380b9b1bf2fbe47837b3c3e9ff7609fb0"},{"bytes":1221,"path":"patch.diff","sha256":"sha256:c33cbd196da908c88c4b1c0f0caba6b76183e76f48553640390bf2847ab7a245"},{"bytes":537,"path":"policy_results.json","sha256":"sha256:07e6dfc6ab5659d6cbadbfcbc54be1f79319e80b4adfebea0799cd7ebb7cd209"},{"bytes":635,"path":"run_manifest.json","sha256":"sha256:65fccb59ce690a502903eb1c8b00d962c08355f2a96b8defb4a9d6882dad8a79"},{"bytes":84,"path":"stderr.log","sha256":"sha256:a40e2c8b96701befeda076281cf1a3607cb4aa3c85fec19235641aa004f4763d"},{"bytes":2010,"path":"stdout.log","sha256":"sha256:edb9ea75f0fc77ebddceffa392eaefe79bb9d2055ab1752873cc49dbb3e64043"},{"bytes":5742,"path":"trace.jsonl","sha256":"sha256:c2e7b0bfe1dbd37a548a722f93826c2e85d15c80e94d8cbc2774f0013b612a24"}],"required_members_present":["candidate_resolution.json","run_manifest.json","trace.jsonl","official_results.json","patch.diff","container_metadata.json","stdout.log","stderr.log","artifact_hashes.json"],"schema_version":1,"task_id":"sphinx-doc__sphinx-9711"}
