{"benchmark_id":"swe_bench_verified","bundle_hash":"sha256:fdbdbde90267009d9932a8b947c0d3072d144039070c04904a705e25455d56ef","bundle_id":"fc8b0210-9cf1-5355-8165-58896b2b97d1","candidate_id":"eea8181f-f42d-59c9-8ed1-425d8372bffc","created_at":"2025-01-01T00:00:00.007Z","created_by_version":"0.1.0","files":[{"bytes":525,"path":"candidate_resolution.json","sha256":"sha256:3f9da847f98c60d3fa3459433c42fc3fac5fd86232ca824e53a3fda28adcfc70"},{"bytes":353,"path":"container_metadata.json","sha256":"sha256:fb473c456638805ac81a74aee3fa3ef86ea81700b0e65d3943b516b584c1d50e"},{"bytes":433,"path":"l1_trusted_rerun_results.json","sha256":"sha256:3f4b190439c49d90af15dc268b87d27569b3e3c4a5e3a56e4c92f7cc14524949"},{"bytes":348,"path":"official_results.json","sha256":"sha256:fbdf4be7c40d9a6d2137e4c73efff22097cf32710303f4be2bc9b290e5b2c94e"},{"bytes":592,"path":"patch.diff","sha256":"sha256:26e70ac624185594670bdc18cb5e9f3cf38089eaefeb29044d9b76672e2c1b3e"},{"bytes":642,"path":"run_manifest.json","sha256":"sha256:07b874912fcfbf6ca84792f33311fbb099f3ae0a78fd7fc8a0b36c1785ec361a"},{"bytes":457,"path":"stderr.log","sha256":"sha256:5a6812fc6ccd3075de1bda400d70eb5a43226c1ead1bb3423ea92aba1ed4aab6"},{"bytes":1336,"path":"stdout.log","sha256":"sha256:0694d669924a7feb685153f8fd2a6d02dc83515ced80fdbce44225ff79648689"},{"bytes":3884,"path":"trace.jsonl","sha256":"sha256:12f8cf2269ed34defe44ef4dd94c030e63af834d3d830ddbf0758ff02a48c0ef"}],"required_members_present":["candidate_resolution.json","run_manifest.json","trace.jsonl","official_results.json","patch.diff","container_metadata.json","stdout.log","stderr.log","artifact_hashes.json"],"schema_version":1,"task_id":"astropy__astropy-14309"}
