{"benchmark_id":"swe_bench_live","bundle_hash":"sha256:ce9694e3d3094358947116d3fe2daffacbae8c595be12dfaaaab9785a1a08192","bundle_id":"6202d7c6-c32d-5b92-b909-fdd3b4460a8d","candidate_id":"fdba011e-5831-5d33-b474-2ca604f6b2e2","created_at":"2025-01-01T00:00:00.007Z","created_by_version":"0.1.0","files":[{"bytes":532,"path":"candidate_resolution.json","sha256":"sha256:9dfbcee628935104e3ba3fb738e3201e324863b451fe9e6d4ae02d546e883197"},{"bytes":329,"path":"container_metadata.json","sha256":"sha256:d488a2a6b143c1b7243c37a462f5a8bdba742bcd2269c27b2456ab1a23a5116c"},{"bytes":410,"path":"l1_trusted_rerun_results.json","sha256":"sha256:2a15191e6e80d13543e2b022f75f7bfd6ef4f8362809c1a330931d6afea40740"},{"bytes":337,"path":"official_results.json","sha256":"sha256:34e9a567a954d6eb1d0089f64c7609a206878e0a18e8a32b316d607e18979d99"},{"bytes":752,"path":"patch.diff","sha256":"sha256:2b2286440b154eea352d2d2b99f2ef6840490edf4494c07e2702a788bcedce05"},{"bytes":648,"path":"run_manifest.json","sha256":"sha256:d822b665415b373e413aba27cedadb5b79904a6ba37cee1b37a82f337dec3249"},{"bytes":0,"path":"stderr.log","sha256":"sha256:e3b0c44298fc1c149afbf4c8996fb92427ae41e4649b934ca495991b7852b855"},{"bytes":401,"path":"stdout.log","sha256":"sha256:fde0e7befd3da850e73f28efc2c660e278f6350869b6475379c24034ad3835a5"},{"bytes":3829,"path":"trace.jsonl","sha256":"sha256:17061d249881b828c1b20f8a57afb9934c83fd5b6771a77ea5e163cda120ae4d"}],"required_members_present":["candidate_resolution.json","run_manifest.json","trace.jsonl","official_results.json","patch.diff","container_metadata.json","stdout.log","stderr.log","artifact_hashes.json"],"schema_version":1,"task_id":"networkx__networkx-8013"}
