{"benchmark_id":"swe_bench_live","bundle_hash":"sha256:8eeda0e8f2c5dfd8d3bd241e9c7b5a33957882f326eb7e42b34dbeb751663ec9","bundle_id":"172aa6d1-9c7f-5311-ba13-9195b31073dd","candidate_id":"c6e378ea-da87-565e-bf48-f39258615d10","created_at":"2025-01-01T00:00:00.007Z","created_by_version":"0.1.0","files":[{"bytes":525,"path":"candidate_resolution.json","sha256":"sha256:94dfe0f7d4149ab2a50f92d60321f0d22c3ec5af62362e463837303566fe4d53"},{"bytes":388,"path":"container_metadata.json","sha256":"sha256:2ee3ebcd69fb9bbde0e74480e8d9200c8c37bf25fcd3525411095a9da265adc3"},{"bytes":492,"path":"l1_trusted_rerun_results.json","sha256":"sha256:6ec1e0930cdfedbd64fdca4f0c686651cf3911533ba7a222e5968ed8666a9af6"},{"bytes":386,"path":"official_results.json","sha256":"sha256:cc91a4d6480be75c6abcc512de20665f322b53ded2bd63ffeb0944ede8859907"},{"bytes":1007,"path":"patch.diff","sha256":"sha256:3835b1b79f73259132035e8424a527ae426e590fef5e8e012847b11696c1b601"},{"bytes":684,"path":"run_manifest.json","sha256":"sha256:514f175febe2e5598a0f2df9b1db3ce4b04235b20b0cc81db2f1f71e12c63a07"},{"bytes":46,"path":"stderr.log","sha256":"sha256:0201f5e0bf02b532b6ed52c553c89ce595011ebb6c26aca63f26bd12732d21d0"},{"bytes":0,"path":"stdout.log","sha256":"sha256:e3b0c44298fc1c149afbf4c8996fb92427ae41e4649b934ca495991b7852b855"},{"bytes":4057,"path":"trace.jsonl","sha256":"sha256:7107295ce86188b8e2d408571bb3ee2ed11a5650d7dc7dc0778dc5c039829f0e"}],"required_members_present":["candidate_resolution.json","run_manifest.json","trace.jsonl","official_results.json","patch.diff","container_metadata.json","stdout.log","stderr.log","artifact_hashes.json"],"schema_version":1,"task_id":"networktocode__ntc-templates-2118"}
