{"benchmark_id":"swe_bench_verified","bundle_hash":"sha256:5954eafc491e877f543368c80885feeb5a9f137571971f8fd51ce27cecd07c14","bundle_id":"d6b3f102-c220-53e2-b3ec-1f4361c8a5d1","candidate_id":"4cb02a28-7acc-5ba6-81eb-4238273a2066","created_at":"2025-01-01T00:00:00.009Z","created_by_version":"0.1.0","files":[{"bytes":507,"path":"candidate_resolution.json","sha256":"sha256:c1fea03876b69275a1da1c2d4f6f53e840b42206c3f650b49ffc43f6fd24b555"},{"bytes":376,"path":"container_metadata.json","sha256":"sha256:a164293cabfe0b8dbcdf686c7dcf5fe9be01aeb919d4639b9c358ea1c6f6b0da"},{"bytes":433,"path":"l1_trusted_rerun_results.json","sha256":"sha256:630648b9281ca4c903148a1e6d471ff4c6a72f489312a246a8b4a37d8224faa3"},{"bytes":348,"path":"official_results.json","sha256":"sha256:72bde7a227e3d06f1a2f45da1a33a66f06a5f557a6f54bce1c8f7b354cafc0c2"},{"bytes":728,"path":"patch.diff","sha256":"sha256:57a810467af331eba7c3238bbcd78268a47e96ad75eed3e2aa8b908da99104bc"},{"bytes":460,"path":"policy_results.json","sha256":"sha256:da4ba93344ba77c17cd51a7e14466f0fcd434cf42af9fc92c7294dccb82d680a"},{"bytes":670,"path":"run_manifest.json","sha256":"sha256:393a747102c8aa4b7fd0071607a0601f83f352417f9019de89b1918d4991e34f"},{"bytes":515,"path":"stderr.log","sha256":"sha256:c6dd7acc6e78d218e2a62d39dcbf1556983acc0a8f8e0a5bed6473c6c5215c6e"},{"bytes":1344,"path":"stdout.log","sha256":"sha256:4582510d41d7d5daac40a05a4216e6992a3dceea7f0d2133f0a6559c87ee6042"},{"bytes":4586,"path":"trace.jsonl","sha256":"sha256:7874d7d2e11f02218be589daa4fed2a15d360574c7c276f979b5943a9ecdf07a"}],"required_members_present":["candidate_resolution.json","run_manifest.json","trace.jsonl","official_results.json","patch.diff","container_metadata.json","stdout.log","stderr.log","artifact_hashes.json"],"schema_version":1,"task_id":"astropy__astropy-14096"}
