{"benchmark_id":"swe_bench_verified","bundle_hash":"sha256:60988664bf22ca471a938acbdd3034049505f055873179c57d9dad5575b4a639","bundle_id":"124fa795-ae29-57db-9e2b-e651234eadad","candidate_id":"e8bed449-1b94-582d-8106-c050624016bf","created_at":"2025-01-01T00:00:00.007Z","created_by_version":"0.1.0","files":[{"bytes":516,"path":"candidate_resolution.json","sha256":"sha256:d3887ccd6d5186b8491c98cfce2d9c4cc130b4b12d9eda2b1f6900bf9fceccb0"},{"bytes":333,"path":"container_metadata.json","sha256":"sha256:432a3d491148a6160cc2bcfba6db298c24aca6643c2a7df89e1255ba37b2531c"},{"bytes":430,"path":"l1_trusted_rerun_results.json","sha256":"sha256:3816c4fb1c785716ccdd52028b284cc84d5d938698b3ccf3628d9aa6af0d9efa"},{"bytes":345,"path":"official_results.json","sha256":"sha256:a66242b860e6ba8ad2ecfa8b4a747d8cf8638eb701c865777fdecb7dc5aca060"},{"bytes":390,"path":"patch.diff","sha256":"sha256:087d51d66413bfa35111ac0eca31f1db1636572702cfd967c428049b453f451d"},{"bytes":652,"path":"run_manifest.json","sha256":"sha256:6957ad1253b66f2f8d1f99542d4d413babac6fdf6b631847fa6cbc42f5c3bd00"},{"bytes":673,"path":"stderr.log","sha256":"sha256:4626bef397c7182da21fe92a4d586b0bf260ac00fce7db7e906f1120ae76d22e"},{"bytes":0,"path":"stdout.log","sha256":"sha256:e3b0c44298fc1c149afbf4c8996fb92427ae41e4649b934ca495991b7852b855"},{"bytes":3860,"path":"trace.jsonl","sha256":"sha256:a2b417ee904c3f96e4c7261b1f747033d919923b826e56b22a383fe080fc64b7"}],"required_members_present":["candidate_resolution.json","run_manifest.json","trace.jsonl","official_results.json","patch.diff","container_metadata.json","stdout.log","stderr.log","artifact_hashes.json"],"schema_version":1,"task_id":"pallets__flask-5014"}
