{"benchmark_id":"swe_bench_verified","bundle_hash":"sha256:fbbb0a09ff5c74c12f00a80e5d3130567206cfb627ec36e091db6142f5eb22fb","bundle_id":"26aa8928-dbf6-5a1c-9677-f9ba92c4a324","candidate_id":"203e0cbc-5ece-56a8-9a2f-87c80e23913c","created_at":"2025-01-01T00:00:00.011Z","created_by_version":"0.1.0","files":[{"bytes":550,"path":"candidate_resolution.json","sha256":"sha256:906b8a9711b9a97ca4a2b7863478110111f93f604419a9aa65a62b80801a5b11"},{"bytes":350,"path":"container_metadata.json","sha256":"sha256:6d75f78e3cfc2414c257579855dafa9bc9c5ccc770fd89cc0c9afb8e0516d559"},{"bytes":408,"path":"l1_trusted_rerun_results.json","sha256":"sha256:f0b1cd4d99881ccbc52e258345250e291bcb7be33c8c41f93d8d3d4f05e2bc84"},{"bytes":335,"path":"official_results.json","sha256":"sha256:d7ced45be6d8dc87bf14253a6fae9c0dd2ad24db167bbb8a0062d3157e457db6"},{"bytes":931,"path":"patch.diff","sha256":"sha256:a0a71ad2a5c85c43e4de99483bfb12cd4baa23b47fc6ba879f0daa7b8a3818a5"},{"bytes":535,"path":"policy_results.json","sha256":"sha256:e394dcce655873972ecc85a04c79ff9c9522181249bcd585b0bfe654425598da"},{"bytes":643,"path":"run_manifest.json","sha256":"sha256:77b0213ce868d5b2c7b5309bf09c228813d64562264ba02d3dcc2995fa0024c4"},{"bytes":181,"path":"stderr.log","sha256":"sha256:6a03d0b09d38d6b5a9d84664a011fc713e39c02fb41554dd1539098fe9bf6b1c"},{"bytes":1499,"path":"stdout.log","sha256":"sha256:2e1b25c7af95f143f1007f3adc0c2b818dd1679befb2ff3127f8afb8e2f52c88"},{"bytes":5678,"path":"trace.jsonl","sha256":"sha256:2269d8c9832e871ccdb82306ec523ca1183e8e7a59213f30f10ce4c078755dbb"}],"required_members_present":["candidate_resolution.json","run_manifest.json","trace.jsonl","official_results.json","patch.diff","container_metadata.json","stdout.log","stderr.log","artifact_hashes.json"],"schema_version":1,"task_id":"astropy__astropy-7671"}
