{"benchmark_id":"swe_bench_verified","bundle_hash":"sha256:b87799f0a8232423be60308df77cd53be5bca7f73d96a7c08f47eef79762734a","bundle_id":"52cceede-c064-5039-8722-56ff310f0b6f","candidate_id":"1170355d-1c04-599b-a7d3-1f55aca3b930","created_at":"2025-01-01T00:00:00.012Z","created_by_version":"0.1.0","files":[{"bytes":552,"path":"candidate_resolution.json","sha256":"sha256:18dab700d4a7aa3a8a4b3201a3444bd6a5f6a21b1381ed5d1199601efb62afaa"},{"bytes":336,"path":"container_metadata.json","sha256":"sha256:b88fdd6c30f3b8db00b144152c2dc4f194b6d5d81ad61713294c5e50ba36d305"},{"bytes":433,"path":"l1_trusted_rerun_results.json","sha256":"sha256:359c073b418020dbefb2018f37a2d8d6a68b966b5ea3fe538b935b908f2418d9"},{"bytes":348,"path":"official_results.json","sha256":"sha256:b958f69cd9fee024126dacf39d5aa864c6fd66e56aca8a9f39fec6dfd3131251"},{"bytes":1267,"path":"patch.diff","sha256":"sha256:f7615b481159620dc1517d316e17a933b1f7315c8242c80ead29e69771f8398f"},{"bytes":552,"path":"policy_results.json","sha256":"sha256:b4ad0cb495f7145c9fc9161477f2356be15a346e82f979710e7e205a963dd8bc"},{"bytes":663,"path":"run_manifest.json","sha256":"sha256:db3121ebb5a3295095d8565f1a9ae47007024ab5620b31df6980c0a69ee4fce0"},{"bytes":673,"path":"stderr.log","sha256":"sha256:4626bef397c7182da21fe92a4d586b0bf260ac00fce7db7e906f1120ae76d22e"},{"bytes":0,"path":"stdout.log","sha256":"sha256:e3b0c44298fc1c149afbf4c8996fb92427ae41e4649b934ca495991b7852b855"},{"bytes":6344,"path":"trace.jsonl","sha256":"sha256:4a88610348ea0b7e5133ee445e839a26a4e6b913ea9bd3622c78d6468e1a0dae"}],"required_members_present":["candidate_resolution.json","run_manifest.json","trace.jsonl","official_results.json","patch.diff","container_metadata.json","stdout.log","stderr.log","artifact_hashes.json"],"schema_version":1,"task_id":"astropy__astropy-14309"}
