{"benchmark_id":"swe_bench_live","bundle_hash":"sha256:c34a153d9c09cf87d089d0be988e96d6b99817c5c4c3bf0d6fff872cda2112e5","bundle_id":"640d1701-29a4-5bb1-917f-8422baf7f9d1","candidate_id":"1baf47c9-68bc-5530-bfd8-00c128089539","created_at":"2025-01-01T00:00:00.007Z","created_by_version":"0.1.0","files":[{"bytes":543,"path":"candidate_resolution.json","sha256":"sha256:4c61c77f93b619416895aac511442c5ee2f8294631bc99466a430d205f5847e9"},{"bytes":354,"path":"container_metadata.json","sha256":"sha256:f6d767699ca31e986d6f03d0a6619405f0a689c080afaf5427649e136566c147"},{"bytes":492,"path":"l1_trusted_rerun_results.json","sha256":"sha256:b7d60ec7fba2fc49c79ed64b4f3cb258e20f0d56b630623babadda1fd9d0a4f6"},{"bytes":386,"path":"official_results.json","sha256":"sha256:f31d3300526bea6719423c79e87eeec2c279ad16c9e70aa0b6f0c8634f3c9035"},{"bytes":1007,"path":"patch.diff","sha256":"sha256:3835b1b79f73259132035e8424a527ae426e590fef5e8e012847b11696c1b601"},{"bytes":683,"path":"run_manifest.json","sha256":"sha256:128da0b53f114edc25badb5b0aad9a0fcaddc8c7162af4b7fa23e5206f13918a"},{"bytes":46,"path":"stderr.log","sha256":"sha256:0201f5e0bf02b532b6ed52c553c89ce595011ebb6c26aca63f26bd12732d21d0"},{"bytes":0,"path":"stdout.log","sha256":"sha256:e3b0c44298fc1c149afbf4c8996fb92427ae41e4649b934ca495991b7852b855"},{"bytes":4050,"path":"trace.jsonl","sha256":"sha256:8932b7e1b706ccfbf015efb318dd0a07f68e56c311230e971d131016e740534d"}],"required_members_present":["candidate_resolution.json","run_manifest.json","trace.jsonl","official_results.json","patch.diff","container_metadata.json","stdout.log","stderr.log","artifact_hashes.json"],"schema_version":1,"task_id":"networktocode__ntc-templates-2118"}
