{"benchmark_id":"swe_bench_verified","bundle_hash":"sha256:6bceec40274adb18f519ba1827b25e2c52b2b40cb023a632631d877b9e50c011","bundle_id":"e4aac8df-4e21-56be-89ff-8dc029400deb","candidate_id":"569d9ec3-8484-5ed5-aa9f-d808dfcdb8c6","created_at":"2025-01-01T00:00:00.007Z","created_by_version":"0.1.0","files":[{"bytes":501,"path":"candidate_resolution.json","sha256":"sha256:e167af303a6002b8e0bea0a787651204a19077ac49d568397ea9f21eb4b8ab71"},{"bytes":364,"path":"container_metadata.json","sha256":"sha256:17293694beee2e93a43d793c450fd6d99d67bcf6b1ad6596e722f66dbd13c33c"},{"bytes":406,"path":"l1_trusted_rerun_results.json","sha256":"sha256:031ea4a0f1bfa15237cfa32a4570a014ae4952550c46b5be28467b669e9c17a8"},{"bytes":333,"path":"official_results.json","sha256":"sha256:4ca651bcc709dbc1894b20f88b2d46cf6b9a86a52f2078bb3754484d6a3a002a"},{"bytes":529,"path":"patch.diff","sha256":"sha256:4bf05606ff37d427b5d1eff27a61b41489785d022c234933fbc8879cad5fd762"},{"bytes":650,"path":"run_manifest.json","sha256":"sha256:5272f196633dcb1deb1e912618ed26a02d622e61e197f4c80fda5e65f71372bb"},{"bytes":0,"path":"stderr.log","sha256":"sha256:e3b0c44298fc1c149afbf4c8996fb92427ae41e4649b934ca495991b7852b855"},{"bytes":1932,"path":"stdout.log","sha256":"sha256:941cac26c7c9ca8c2f2b92e8778f9dfce545292b4dc58992c800a32ee0cced87"},{"bytes":3808,"path":"trace.jsonl","sha256":"sha256:9b9e1fea363af0efc9a5c9b05bb28982b658cb54ab214d6b30c31d00d33a2192"}],"required_members_present":["candidate_resolution.json","run_manifest.json","trace.jsonl","official_results.json","patch.diff","container_metadata.json","stdout.log","stderr.log","artifact_hashes.json"],"schema_version":1,"task_id":"pydata__xarray-2905"}
