{"benchmark_id":"swe_bench_verified","bundle_hash":"sha256:208d7ee907277959b646114bb7e6281d0499e332815a66cb308e9474e3893b93","bundle_id":"af9f602a-2c10-5cb4-9223-71ecba33f836","candidate_id":"769784e1-748a-5ac0-bea4-03ef6dcd9841","created_at":"2025-01-01T00:00:00.009Z","created_by_version":"0.1.0","files":[{"bytes":587,"path":"candidate_resolution.json","sha256":"sha256:fdcabbb509905ed9f51f6fc3808d6eafb82f4420ee4fdae68cb2771e411b07a6"},{"bytes":698,"path":"container_metadata.json","sha256":"sha256:4fd4d7bbc15511cd6de8a835926aa3b164b459b2713eeaf8dc61dde7a0c1ac53"},{"bytes":429,"path":"l1_trusted_rerun_results.json","sha256":"sha256:96a4a01905ea315f61a3a992997b875f390bfa18f0d8b07852e8d0480ba18340"},{"bytes":344,"path":"official_results.json","sha256":"sha256:bf7de4e76580d5df25deac7c67ff2f5a11de990c128a78946cbca20a85f842e6"},{"bytes":1592,"path":"patch.diff","sha256":"sha256:5a9b639d1a868de337e5db3002d615579cd8cb82e94f08e7f50f3f6b4d8ca094"},{"bytes":988,"path":"run_manifest.json","sha256":"sha256:b429fecae2f3988c775dfc162c63852879dfe88bb86e7302157ebaac1202d217"},{"bytes":229,"path":"stderr.log","sha256":"sha256:b98df104130cb30d5ddde7a251a055d2d9beb3ea501d9207c522ebc8b21d2261"},{"bytes":4030,"path":"stdout.log","sha256":"sha256:75252208ee9244cffb67147f117b9d34f7d26c48c261d65bb7c58b6be5d4d8dc"},{"bytes":709,"path":"strengthened_results.json","sha256":"sha256:a1527f11c74090c94922c479a970b8af548a1262324e852bb425a3f929355e8f"},{"bytes":781,"path":"strengthening_report.json","sha256":"sha256:f3cc4d1a6cc368a4c6a87a056e0a5a1ec269d85e6092e28f3f65d267fe8755b3"},{"bytes":5567,"path":"trace.jsonl","sha256":"sha256:a0ed7f10624ed06ea9b6d14264347675f6998f5158acff45b6f70b9de19f7ecf"}],"required_members_present":["candidate_resolution.json","run_manifest.json","trace.jsonl","official_results.json","patch.diff","container_metadata.json","stdout.log","stderr.log","artifact_hashes.json"],"schema_version":1,"task_id":"psf__requests-1766"}
