{"benchmark_id":"swe_bench_verified","bundle_hash":"sha256:09036e11038dd4953c1d171ce54469abe41a19da5374517f40d5d1021b39c3db","bundle_id":"f78c6a7e-aa02-50f3-bab9-87ddd275e2c3","candidate_id":"3c472ac3-4f96-5e31-b144-74f6e4af50c8","created_at":"2025-01-01T00:00:00.010Z","created_by_version":"0.1.0","files":[{"bytes":588,"path":"candidate_resolution.json","sha256":"sha256:09215c3838eae4643ccc94d2f5c207754df8165431df4540d5d281df91088427"},{"bytes":371,"path":"container_metadata.json","sha256":"sha256:f2abe024a9854c9247788ae47278fce53952394581e37b978e55ee1564fb3d5a"},{"bytes":487,"path":"l1_trusted_rerun_results.json","sha256":"sha256:d4c61c8e28af10cfe8077701d363e8afc9ba0fbab7fb503b2b62a22acc05b589"},{"bytes":381,"path":"official_results.json","sha256":"sha256:b12d65f8b3323149cf5fdb25518d6faeeb944b60625b663d8cdcc192478016df"},{"bytes":753,"path":"patch.diff","sha256":"sha256:d90258463035a063dbabb8e861cfcd2f9ddd84f94bff5bd81fd920e8cc34cf28"},{"bytes":509,"path":"policy_results.json","sha256":"sha256:c34bb648fefc2e3e0143763e33a2c6faf75d2a9cb98dc124a4df5ad9849b7d35"},{"bytes":671,"path":"run_manifest.json","sha256":"sha256:4d0b1cce570b4ad0c8e068f0a72ed76e4ce0251bde3ce1a4c8bd015f255dfdc0"},{"bytes":460,"path":"stderr.log","sha256":"sha256:10edd912b85d5fdde3abc36c732c1f9eb3057973c75c44a016bd28d024433ef2"},{"bytes":0,"path":"stdout.log","sha256":"sha256:e3b0c44298fc1c149afbf4c8996fb92427ae41e4649b934ca495991b7852b855"},{"bytes":5298,"path":"trace.jsonl","sha256":"sha256:761a98c3b8bd1b2f69fa9280a58667daa9c65a815db117944f10ab3d2249c603"}],"required_members_present":["candidate_resolution.json","run_manifest.json","trace.jsonl","official_results.json","patch.diff","container_metadata.json","stdout.log","stderr.log","artifact_hashes.json"],"schema_version":1,"task_id":"matplotlib__matplotlib-25122"}
