{"benchmark_id":"swe_bench_verified","bundle_hash":"sha256:cdf7a4abaf8b84c12c859324b328858373eb1ff8a0cf62743f55d5ecdcede99c","bundle_id":"57cc355e-cdc5-5d17-9927-afcfc2f10e22","candidate_id":"13c7660d-5d9e-50c3-991b-1b459869a3bb","created_at":"2025-01-01T00:00:00.011Z","created_by_version":"0.1.0","files":[{"bytes":546,"path":"candidate_resolution.json","sha256":"sha256:f6c159189bca4e8c70871101df24370844bc1809c3639c638f49bab7ad9f6e11"},{"bytes":382,"path":"container_metadata.json","sha256":"sha256:82912cf08c2c792cd53dbbaf0a487321d068babf36d4fd137c42d5b9d28d6b1a"},{"bytes":406,"path":"l1_trusted_rerun_results.json","sha256":"sha256:b7a6d648958518b637d8f3745b8fff77b44e492c95417ec1d5c433c34161da7d"},{"bytes":333,"path":"official_results.json","sha256":"sha256:7232c428a0e602e618000ff69dd6cb19b9805d56966deb70b0028f7850f26d1c"},{"bytes":1138,"path":"patch.diff","sha256":"sha256:8263dfabf57dfc2fa97341cd7e1d3c4d6a3097a9b09c1d422236cfa9838577ae"},{"bytes":533,"path":"policy_results.json","sha256":"sha256:d9824c8af40d1f9fdadae348d05489ab02821ea6c808455ac1d9d65873070ce7"},{"bytes":673,"path":"run_manifest.json","sha256":"sha256:7f4b26bf521cd67509760919373a4627f372db8e6223b3b2a89994ece368f681"},{"bytes":98,"path":"stderr.log","sha256":"sha256:19b067baef02047d03060a889831f3a424a9731cc18b22c0ff5b8546a46d80d5"},{"bytes":350,"path":"stdout.log","sha256":"sha256:0feacc4101ef99ac0ba04bde3767bf3e265bcff005d2a1341cddf320266707e5"},{"bytes":5693,"path":"trace.jsonl","sha256":"sha256:d6184861c4d07f5df8c07dda2c35e7eac51f5ce5458bd1cd23c9f771e1844f69"}],"required_members_present":["candidate_resolution.json","run_manifest.json","trace.jsonl","official_results.json","patch.diff","container_metadata.json","stdout.log","stderr.log","artifact_hashes.json"],"schema_version":1,"task_id":"django__django-7530"}
