{"benchmark_id":"swe_bench_verified","bundle_hash":"sha256:1ea49c3348374ee2fe77e11017422e8ee2b89341933d53108f99b719f124d913","bundle_id":"a63596ca-9a07-5921-b984-4d41c556e447","candidate_id":"4c8c378e-267f-5dca-9f39-9f119ab4fb6f","created_at":"2025-01-01T00:00:00.012Z","created_by_version":"0.1.0","files":[{"bytes":587,"path":"candidate_resolution.json","sha256":"sha256:098408541f72dbd2ea97c7ee9e70ed2e4fe0cf7791e3e7b4b721aa97cc02057e"},{"bytes":305,"path":"container_metadata.json","sha256":"sha256:3539b304f2cb334f659eabb6b65efa7a34dab54b81e8394287b1a1eca8a0999d"},{"bytes":477,"path":"l1_trusted_rerun_results.json","sha256":"sha256:ef02a69523d131ce410868008e995fbb332995b6dde628d77612619466cc3f25"},{"bytes":371,"path":"official_results.json","sha256":"sha256:d2b39d8e2f275cc54a8ecc0a6914a7f67e7ccf8a4b9b6cee0511603eb12ea39e"},{"bytes":1205,"path":"patch.diff","sha256":"sha256:99c835772b849693ceb2fc2d802887c1e21f1975dad5b78bf896eaf4e2ea797b"},{"bytes":548,"path":"policy_results.json","sha256":"sha256:f8cbc3dcd676605b283b8e9990f7e219c045acfbf0e1fdf5624e70439be33221"},{"bytes":595,"path":"run_manifest.json","sha256":"sha256:89f24ffb58e72fcb3598dd9a48d3a1c43fdf7b6407b0d8497b9d0da2e3148b51"},{"bytes":64,"path":"stderr.log","sha256":"sha256:8840bae3e8ca2278792dca956a4c959ed92eac317ee2b0a1612b73c21d72c74c"},{"bytes":0,"path":"stdout.log","sha256":"sha256:e3b0c44298fc1c149afbf4c8996fb92427ae41e4649b934ca495991b7852b855"},{"bytes":6266,"path":"trace.jsonl","sha256":"sha256:9ebc410dca850c1eb533ded401181d6c7bb04fdb022dbd6dd3de5e07b297745b"}],"required_members_present":["candidate_resolution.json","run_manifest.json","trace.jsonl","official_results.json","patch.diff","container_metadata.json","stdout.log","stderr.log","artifact_hashes.json"],"schema_version":1,"task_id":"sympy__sympy-23262"}
