{"benchmark_id":"swe_bench_verified","bundle_hash":"sha256:2f44a2b4ca8c95215769f78613b4c4522a98a18a79d5db61b4e0056e47ca2394","bundle_id":"d44b526e-47e2-5e47-87e7-86aee78d0c01","candidate_id":"2dc707b5-d0ae-5d29-9546-d831f7e05444","created_at":"2025-01-01T00:00:00.012Z","created_by_version":"0.1.0","files":[{"bytes":589,"path":"candidate_resolution.json","sha256":"sha256:ca3f80fbeb04a39f4750e4c91d4b903c5d16cb77056c8e5d3815bead74dddbed"},{"bytes":382,"path":"container_metadata.json","sha256":"sha256:82912cf08c2c792cd53dbbaf0a487321d068babf36d4fd137c42d5b9d28d6b1a"},{"bytes":406,"path":"l1_trusted_rerun_results.json","sha256":"sha256:f590f430b88eeb967f2f4be6a3b5cdf4c98cd64939ad457c8fd48f7a54c292b8"},{"bytes":333,"path":"official_results.json","sha256":"sha256:c7981a837369660f99a965fd69ffe6a1dc9e0b65a7de133ab94d0b4d6b3f5a64"},{"bytes":5225,"path":"patch.diff","sha256":"sha256:e7af5ce5017a418d7316293fe5f1825db1d294cf9cc308d0e713bf11be552bd4"},{"bytes":549,"path":"policy_results.json","sha256":"sha256:81f2061721d9577f0b5a9695ad838cd09c32af066499683e8f2cb473a6fe0521"},{"bytes":673,"path":"run_manifest.json","sha256":"sha256:fda5240436d6eb7e189d520b3b96d42065262a32338ab21e7a5ba0af77d90374"},{"bytes":98,"path":"stderr.log","sha256":"sha256:1de6ecf0d697d79c3df1c8a42338798c31313705d18a2a67f513a8f2e0925826"},{"bytes":350,"path":"stdout.log","sha256":"sha256:0feacc4101ef99ac0ba04bde3767bf3e265bcff005d2a1341cddf320266707e5"},{"bytes":6276,"path":"trace.jsonl","sha256":"sha256:6d7662b517605425ae62889ef558b8b7d53e001e3c6be506133d54f4152b3292"}],"required_members_present":["candidate_resolution.json","run_manifest.json","trace.jsonl","official_results.json","patch.diff","container_metadata.json","stdout.log","stderr.log","artifact_hashes.json"],"schema_version":1,"task_id":"django__django-7530"}
