{"benchmark_id":"swe_bench_verified","bundle_hash":"sha256:a03c4ed6b9ba812b4a2be8de30d008a7845c2e6cebbb988dd55680712f6c8494","bundle_id":"815983a3-5b6a-5452-a88e-87ccdaf3d3c9","candidate_id":"4ee50e48-5b1b-5b1e-814b-0ed81a059a27","created_at":"2025-01-01T00:00:00.011Z","created_by_version":"0.1.0","files":[{"bytes":568,"path":"candidate_resolution.json","sha256":"sha256:e3de5725ac7e6c2e1f08688629f0f1bda63d68e55e28a12595db01a115d0c8bd"},{"bytes":313,"path":"container_metadata.json","sha256":"sha256:f08896ebce9c44792c5830c0d4295fc52b95d8962645ea54afecea67b8778381"},{"bytes":477,"path":"l1_trusted_rerun_results.json","sha256":"sha256:9beba0181b79a4e8d48592c4c994057011726b7a84fcc029303b2b289b37163e"},{"bytes":371,"path":"official_results.json","sha256":"sha256:008a7e9a4ec4d438aa2469ec6fda4b8de26d2ba4ac757bd7cce4565f9eab0cec"},{"bytes":1418,"path":"patch.diff","sha256":"sha256:b76767fff171f5338508fbd7f7af40a2292ae2bf90e6e8b35fd3313d48dd76f9"},{"bytes":532,"path":"policy_results.json","sha256":"sha256:6cd7a6224f4c09163a8a04a6c48cdb1bb09338e7b5542cd71def03a8c0a1ce3d"},{"bytes":603,"path":"run_manifest.json","sha256":"sha256:2f7f41bc2b740d86f9b9556ef0b7baa479bd8b45c564d2ad55a13d7ab91b73eb"},{"bytes":64,"path":"stderr.log","sha256":"sha256:8840bae3e8ca2278792dca956a4c959ed92eac317ee2b0a1612b73c21d72c74c"},{"bytes":0,"path":"stdout.log","sha256":"sha256:e3b0c44298fc1c149afbf4c8996fb92427ae41e4649b934ca495991b7852b855"},{"bytes":5698,"path":"trace.jsonl","sha256":"sha256:52762df602f7187cb9ab65902d6edeee1217590dc62833fef2f9b5a8e919317c"}],"required_members_present":["candidate_resolution.json","run_manifest.json","trace.jsonl","official_results.json","patch.diff","container_metadata.json","stdout.log","stderr.log","artifact_hashes.json"],"schema_version":1,"task_id":"sympy__sympy-24539"}
