{"benchmark_id":"swe_bench_verified","bundle_hash":"sha256:9fd660e63454342f402d8a826c0b2f121c3b0fb15bb7bf5d1f129da0fbfc3304","bundle_id":"37c6d2de-6041-5a67-869a-97c25b7ef7c8","candidate_id":"e09b20a8-ae09-51f5-b332-a04bd3227628","created_at":"2025-01-01T00:00:00.011Z","created_by_version":"0.1.0","files":[{"bytes":578,"path":"candidate_resolution.json","sha256":"sha256:48e8aa2cf1fa748e3a4444d9125a43e673c4a2a56f498967708797a91c0a4efd"},{"bytes":384,"path":"container_metadata.json","sha256":"sha256:b33a27aadb1bcf76b1c6bd686e75b9c7e36aca111c02677811219ffd9873a0f6"},{"bytes":434,"path":"l1_trusted_rerun_results.json","sha256":"sha256:34ad95ce20d1343c142b7876324f09c7ccf1c7433d63ea8247f081dc0117a571"},{"bytes":349,"path":"official_results.json","sha256":"sha256:bf3538b04728ad5b3a44a77c55d5c5b297e18d94a20f728c465d3250fec77e1a"},{"bytes":958,"path":"patch.diff","sha256":"sha256:56e4fe18fc9756b364ba79540502f1a8eaa99ae18d03bab27850376c473fe73e"},{"bytes":537,"path":"policy_results.json","sha256":"sha256:a699db96eab65e83156b11764da540615331be8ad7768a36fb05a75bf14bb07d"},{"bytes":679,"path":"run_manifest.json","sha256":"sha256:58f667c94a6504cbd06ba2ce9545b959ac246a5d934d50594cea692d70805203"},{"bytes":285,"path":"stderr.log","sha256":"sha256:1dfba8ae8db28da807a9a2a0f19ae35ba290f274b37812b5a87df5983a8e9c5b"},{"bytes":1048,"path":"stdout.log","sha256":"sha256:de0f46a9af139d2bc7b8e3fcf1911c14fcdde7734f76b3de4536a59bcf31dfb6"},{"bytes":5784,"path":"trace.jsonl","sha256":"sha256:1805c30ca7a447363452ac097924d07d4c92f962cebb6fa963d420751d3c35a0"}],"required_members_present":["candidate_resolution.json","run_manifest.json","trace.jsonl","official_results.json","patch.diff","container_metadata.json","stdout.log","stderr.log","artifact_hashes.json"],"schema_version":1,"task_id":"pylint-dev__pylint-6903"}
