{"benchmark_id":"swe_bench_verified","bundle_hash":"sha256:6153dd7a73eef33d41c8bb46c175aa4cf1c0d1c33ce1adc3e2eb516d9e5b2306","bundle_id":"1f06ef2c-3d24-55d5-8669-008515ad1e2c","candidate_id":"efa42df6-1271-5b93-959e-63ab1459760a","created_at":"2025-01-01T00:00:00.012Z","created_by_version":"0.1.0","files":[{"bytes":615,"path":"candidate_resolution.json","sha256":"sha256:61adbe33c657fa3421d775c482cf9e6cfe39083ebcf18ec5f8201b28ee387967"},{"bytes":371,"path":"container_metadata.json","sha256":"sha256:ddbbce6b862932b3990c89c263cb4d4f6a3ad275b79dc0a393f5a5bbf42e0266"},{"bytes":491,"path":"l1_trusted_rerun_results.json","sha256":"sha256:b6b83246c7bda78c34d5549eb5425d328a72b520169ccfb8432c4b98cc999497"},{"bytes":385,"path":"official_results.json","sha256":"sha256:19b668cdf8b9fce85705b7c9438d410db61c04b96d81aeebb38dc10ebb474277"},{"bytes":2351,"path":"patch.diff","sha256":"sha256:2c5b662331b7b3f17f515683f5ecb4ee3f215f100a10f9a839ea5a072b8f4264"},{"bytes":562,"path":"policy_results.json","sha256":"sha256:322780b3d2a11ed7b8b17b7db9820cb92a6572bd5d0f6d36102da832ce17805b"},{"bytes":675,"path":"run_manifest.json","sha256":"sha256:a87f0b2e4db19e40bb263ecfe3d4605adbb7666cbc567d59ea10712a33dd2226"},{"bytes":1138,"path":"stderr.log","sha256":"sha256:d730e20c2c38bd28452233075bc5e89a54438349f28e8aee8c3452ca5807fad4"},{"bytes":0,"path":"stdout.log","sha256":"sha256:e3b0c44298fc1c149afbf4c8996fb92427ae41e4649b934ca495991b7852b855"},{"bytes":6512,"path":"trace.jsonl","sha256":"sha256:8d6884fa5be0803b7d40ce63a6c67c4b46345ad9d3652e5e700c55a7891b4473"}],"required_members_present":["candidate_resolution.json","run_manifest.json","trace.jsonl","official_results.json","patch.diff","container_metadata.json","stdout.log","stderr.log","artifact_hashes.json"],"schema_version":1,"task_id":"scikit-learn__scikit-learn-14894"}
