{"benchmark_id":"swe_bench_verified","bundle_hash":"sha256:662dfdc82f05c03611daa4d3d3a67387207006f82160cd3d3b11821b14b5bc49","bundle_id":"f32747b5-f4ee-545c-8db9-f0323de25a6e","candidate_id":"2342dcfd-05f1-5eed-815c-38322096db3e","created_at":"2025-01-01T00:00:00.011Z","created_by_version":"0.1.0","files":[{"bytes":554,"path":"candidate_resolution.json","sha256":"sha256:595227d47f0b356e8aa3493badcd2e407b599f86820e4a362d6dbcc6b2177cce"},{"bytes":340,"path":"container_metadata.json","sha256":"sha256:3a84b42f5371f2130b8ea50211935aacb5c5477ed74221d3470d769124d7f281"},{"bytes":410,"path":"l1_trusted_rerun_results.json","sha256":"sha256:bf49ac700715fc46842024b4dcd79142d33c18a38d34e79ccc78f2280ca92e73"},{"bytes":337,"path":"official_results.json","sha256":"sha256:5868d47dc7b24aa9bbf242f288cf053595ba3f165b661e0b302d003145180661"},{"bytes":624,"path":"patch.diff","sha256":"sha256:a012fe0bb8d53e6d811a89e1c979a90346f30b957669ad5b1f7146c6f1208117"},{"bytes":537,"path":"policy_results.json","sha256":"sha256:4e041fe1ef629f44251a3f80da581a7918ed220fbb051ee486ba86a783c8b5df"},{"bytes":635,"path":"run_manifest.json","sha256":"sha256:af89e57360aaca17be449d41aa33c8ef05b09b37ab6eae3163bc32204e255ea7"},{"bytes":0,"path":"stderr.log","sha256":"sha256:e3b0c44298fc1c149afbf4c8996fb92427ae41e4649b934ca495991b7852b855"},{"bytes":2090,"path":"stdout.log","sha256":"sha256:2d768a75c31b1f44de38094cbb8eacc73a4bc27644de166bda47f13f071ab31b"},{"bytes":5686,"path":"trace.jsonl","sha256":"sha256:6963713ed6e5bb60aea29c459ffc0ff86c288c9ab62fe7094fcf921f1af40c36"}],"required_members_present":["candidate_resolution.json","run_manifest.json","trace.jsonl","official_results.json","patch.diff","container_metadata.json","stdout.log","stderr.log","artifact_hashes.json"],"schema_version":1,"task_id":"sphinx-doc__sphinx-9698"}
