{"benchmark_id":"swe_bench_live","bundle_hash":"sha256:a6e2022d1a9b8bcc8b7166a5eb30808fb506bfdb17e3afe3e71f04c0c75c3b29","bundle_id":"1674111e-6021-503e-870f-d5e92e834ac8","candidate_id":"05ee013a-2225-5c58-a6cf-11aa20b007ce","created_at":"2025-01-01T00:00:00.007Z","created_by_version":"0.1.0","files":[{"bytes":507,"path":"candidate_resolution.json","sha256":"sha256:f7eca72f28519a8eaeebdbce7086c293f70d70b470190d09b808b2b825c385ed"},{"bytes":387,"path":"container_metadata.json","sha256":"sha256:20c65e2256bb93cd66292a10add97ff31964d5e5f8364386324b71bd4e84e9c5"},{"bytes":435,"path":"l1_trusted_rerun_results.json","sha256":"sha256:09a6e01cbc78ca5ca835d45121217889dfa86cc8307c5c854996f8999a3c7f1e"},{"bytes":350,"path":"official_results.json","sha256":"sha256:dcf3f82caa5f5c30066a162a5d839993e97aa01015be6d81d0776a6daac0b86c"},{"bytes":8103,"path":"patch.diff","sha256":"sha256:671ae7d81bf2bb4a3299297f616ea8ea22c42830406757e8f483e195a14f93a8"},{"bytes":674,"path":"run_manifest.json","sha256":"sha256:8ad24c55accccd855ac6c254c54186db21efe454d4f1ef52ba7166fa28640929"},{"bytes":188,"path":"stderr.log","sha256":"sha256:4a61348bb417e8bbe66f98a3a0dc920858423d0d345eef9b35c3593d4e94b4c5"},{"bytes":571,"path":"stdout.log","sha256":"sha256:be35d186b22c8ea72bffa6d321e90c365185e00dfdf5c5a501791ddee3f8dfbb"},{"bytes":3933,"path":"trace.jsonl","sha256":"sha256:90805dc6affa3f2a6b1f9bdcb6e0fdc65b60156ac92ef2dc9a6fc8682a66c74c"}],"required_members_present":["candidate_resolution.json","run_manifest.json","trace.jsonl","official_results.json","patch.diff","container_metadata.json","stdout.log","stderr.log","artifact_hashes.json"],"schema_version":1,"task_id":"pyca__cryptography-12812"}
