{"benchmark_id":"swe_bench_verified","bundle_hash":"sha256:08ac3ac0cbd9ecdc31b1e17953bdd06ed2080f67bcbb7bbe8ca4b6d695d324e1","bundle_id":"7d4678ec-d53d-54a0-8c31-ea047326243c","candidate_id":"ef91570f-e14b-5170-9aa9-a3cc4827b0d5","created_at":"2025-01-01T00:00:00.009Z","created_by_version":"0.1.0","files":[{"bytes":521,"path":"candidate_resolution.json","sha256":"sha256:c7535893e8606ace59236d47fad52e3a74c8bb271f30a3ce240558facabbb4be"},{"bytes":366,"path":"container_metadata.json","sha256":"sha256:3b061819e7fa39e635724dff14360750cc3ea5f7d85025620258249876bf5883"},{"bytes":431,"path":"l1_trusted_rerun_results.json","sha256":"sha256:d24a4bf8e45c906bd54f6a1736c2c2063959b6933e92c577d7a4c26342add804"},{"bytes":346,"path":"official_results.json","sha256":"sha256:6a02d8ad7ea382148c37e5ac82a3fe6cc5b7588fbd660a32ae4a1d2b5deb3759"},{"bytes":527,"path":"patch.diff","sha256":"sha256:d09c1eff4eb13be7283fdef31426f86222cf8b059623b4b95c4ef8a1d1544a42"},{"bytes":458,"path":"policy_results.json","sha256":"sha256:ee41b307da4aa2c6fbe5663ae8384a21c985445c8802a848156bec6bffc8e93a"},{"bytes":658,"path":"run_manifest.json","sha256":"sha256:451ea182b3a2953aec78af9a4568a3f3e8cbc759fdee843c5e04f844d39d6495"},{"bytes":415,"path":"stderr.log","sha256":"sha256:7c8a25d248c2a3ae6a0ace7804f4816ab4c4d81a6f28d3bc9ed00222fb5b0e31"},{"bytes":126,"path":"stdout.log","sha256":"sha256:1546760bc73eae0a1c2ea15347ca9bfc4f5d451a17b246a4508979b6220c0f17"},{"bytes":4556,"path":"trace.jsonl","sha256":"sha256:3a48445b2d92f2924a236572f14b0e49af5c7e1136d6e5bfe34ba24e55ca01c3"}],"required_members_present":["candidate_resolution.json","run_manifest.json","trace.jsonl","official_results.json","patch.diff","container_metadata.json","stdout.log","stderr.log","artifact_hashes.json"],"schema_version":1,"task_id":"django__django-11211"}
