{"benchmark_id":"swe_bench_live","bundle_hash":"sha256:ce9a9a48dfcee3de91ec4352face087e4102966d539eeeb6674dee61cf18e137","bundle_id":"7343db51-ddb1-5fc8-a3eb-f4242f30b872","candidate_id":"879a42e9-dbc3-5789-a232-81f5821fb01f","created_at":"2025-01-01T00:00:00.007Z","created_by_version":"0.1.0","files":[{"bytes":511,"path":"candidate_resolution.json","sha256":"sha256:a1cbfa1c0924a7028b9841f6871b974a633d3d2d79a9dfff7eba9921ac901fa8"},{"bytes":573,"path":"container_metadata.json","sha256":"sha256:f16127170c86dca533788867087958adf2aece6d02358157a10cee7ad6a41da7"},{"bytes":485,"path":"l1_trusted_rerun_results.json","sha256":"sha256:b8a2972b1c28a31f03734202f19b2a0de21bc683859da61578811f329b7c4427"},{"bytes":379,"path":"official_results.json","sha256":"sha256:9e0d9d9c28267c381cf34e3179834aedec21cd82f69e9144ecaafb83e528add6"},{"bytes":837,"path":"patch.diff","sha256":"sha256:dc9dda7e97c2fe000ae12306544b1a629933072e142ec685d3274d313823c373"},{"bytes":862,"path":"run_manifest.json","sha256":"sha256:44da52e0f44ee91abb5d9217a214602c6075c308b9a8c9585a4490576f82bbb5"},{"bytes":46,"path":"stderr.log","sha256":"sha256:0201f5e0bf02b532b6ed52c553c89ce595011ebb6c26aca63f26bd12732d21d0"},{"bytes":0,"path":"stdout.log","sha256":"sha256:e3b0c44298fc1c149afbf4c8996fb92427ae41e4649b934ca495991b7852b855"},{"bytes":4178,"path":"trace.jsonl","sha256":"sha256:c217a69979d87aab5945d83cefd6dc09da7188077bd695add9d4d7d80b824aa8"}],"required_members_present":["candidate_resolution.json","run_manifest.json","trace.jsonl","official_results.json","patch.diff","container_metadata.json","stdout.log","stderr.log","artifact_hashes.json"],"schema_version":1,"task_id":"apify__crawlee-python-1181"}
