{"benchmark_id":"swe_bench_verified","bundle_hash":"sha256:58440f43ceb6b1ca739133f6801a2f8b67cfb2878b31e4a89330f214c1ade858","bundle_id":"36f2f0bf-b8d0-5ca1-9a75-0e42ed4bf31b","candidate_id":"63034982-f6b4-52ec-bca2-71147619372d","created_at":"2025-01-01T00:00:00.007Z","created_by_version":"0.1.0","files":[{"bytes":501,"path":"candidate_resolution.json","sha256":"sha256:11a9ecb5fcbfe99b543f997b93aca71eb5f132f4f57d31072102d6c1b66d288f"},{"bytes":364,"path":"container_metadata.json","sha256":"sha256:17293694beee2e93a43d793c450fd6d99d67bcf6b1ad6596e722f66dbd13c33c"},{"bytes":406,"path":"l1_trusted_rerun_results.json","sha256":"sha256:e068900973020b0fa7eab3bdcdb009d9f2e4450d018676daea6d7d933f5515eb"},{"bytes":333,"path":"official_results.json","sha256":"sha256:817fd35fa86fff9b18ed03b52becf086db1167065aa1b1a4de3d579ef3e8df98"},{"bytes":529,"path":"patch.diff","sha256":"sha256:4bf05606ff37d427b5d1eff27a61b41489785d022c234933fbc8879cad5fd762"},{"bytes":650,"path":"run_manifest.json","sha256":"sha256:cac36e0177f82804f550efe2bd0d4723fb275178e162b9b760b681296cb50546"},{"bytes":0,"path":"stderr.log","sha256":"sha256:e3b0c44298fc1c149afbf4c8996fb92427ae41e4649b934ca495991b7852b855"},{"bytes":1932,"path":"stdout.log","sha256":"sha256:37c487d4024c9d62d942cf534285393dad03725dd3e4772048749f14fdb90392"},{"bytes":3808,"path":"trace.jsonl","sha256":"sha256:1f10c3021a9c586db97dc17b7923e9bbce714f3416bada7ed809ef5464cd7989"}],"required_members_present":["candidate_resolution.json","run_manifest.json","trace.jsonl","official_results.json","patch.diff","container_metadata.json","stdout.log","stderr.log","artifact_hashes.json"],"schema_version":1,"task_id":"pydata__xarray-2905"}
